{
  "meta": {
    "slug": "triana_reformas",
    "titulo": "Triana en cifras",
    "subtitulo": "Anatomía de una entrevista reformista: dónde acierta, dónde falla la aritmética y a quién se deja de nombrar",
    "descripcion": "Disección de una entrevista de ~67 minutos con el economista Juan Triana sobre el paquete de reformas cubano. Diagnóstico general sólido; precisión cuantitativa y atribución causal, mucho más débiles.",
    "narracion": "Juan Triana representa a un economista reformista dentro del marco institucional cubano. Su diagnóstico general es sólido: exige secuencia y responsables, critica el exceso de empresas estatales, defiende subsidiar personas en lugar de productos y reconoce al sector privado como estratégico. Pero cuando pasa a las cifras, el rigor se desploma. Su aritmética petrolera es incompatible consigo misma; confunde el coste de reconstruir el sistema eléctrico; y usa comparaciones sin denominador. Además, para los fallos internos emplea abstracciones como resistencia o implementación, mientras que para la política estadounidense usa sujetos, nombres e intenciones. El resultado es un análisis que ayuda a mover el debate desde la prohibición hacia la reforma, pero que no termina de romper con el lenguaje y las omisiones que permitieron el estancamiento.",
    "fecha_analisis": "2026-07-14",
    "actualizado": "2026-07-14",
    "duracion_min": 67,
    "programa": "A lo cortico — La Joven Cuba",
    "entrevistado": "Juan Triana",
    "genero": "economista"
  },
  "veredicto": {
    "resumen": "No es un economista incompetente. Es un economista con formación y experiencia, condicionado por dos límites: una tradición económica excesivamente discursiva, con pocos números auditables, y una prudencia política que le impide identificar quién tomó las decisiones responsables del estancamiento.",
    "dimensiones": [
      { "clave": "Conocimiento institucional e histórico", "nivel": "alto", "valor": 85 },
      { "clave": "Intuición microeconómica", "nivel": "media-alta", "valor": 68 },
      { "clave": "Precisión cuantitativa", "nivel": "baja", "valor": 26 },
      { "clave": "Análisis macroeconómico y causal", "nivel": "medio-bajo", "valor": 38 },
      { "clave": "Independencia frente al relato oficial", "nivel": "limitada", "valor": 45 },
      { "clave": "Programa verificable", "nivel": "insuficiente", "valor": 30 }
    ]
  },
  "puntuacion": {
    "escala": 10,
    "nota": "Puntuación de esta intervención concreta, no de toda la carrera académica.",
    "items": [
      { "dimension": "Conocimiento de la economía cubana", "valor": 8 },
      { "dimension": "Intuición sobre reformas de mercado", "valor": 7 },
      { "dimension": "Claridad pedagógica", "valor": 6 },
      { "dimension": "Precisión numérica", "valor": 3 },
      { "dimension": "Consistencia aritmética", "valor": 2 },
      { "dimension": "Análisis causal", "valor": 4 },
      { "dimension": "Comparación internacional", "valor": 3 },
      { "dimension": "Independencia crítica", "valor": 5 },
      { "dimension": "Diseño operativo de políticas", "valor": 4 },
      { "dimension": "Utilidad global de la entrevista", "valor": 6 }
    ]
  },
  "petroleo": {
    "titulo": "La cuadratura imposible",
    "intro": "Triana ofrece tres cifras sobre la necesidad petrolera del país. Las tres no pueden ser simultáneamente correctas. Mueve el consumo diario y compruébalo: no existe ningún valor que satisfaga las tres a la vez.",
    "cargamento_barriles": 800000,
    "necesidad_min_bpd": 130000,
    "necesidad_max_bpd": 150000,
    "dias_afirmados": 15,
    "afirmaciones": [
      { "id": "diaria", "texto": "Necesidad diaria de 130.000 a 150.000 barriles" },
      { "id": "duracion", "texto": "Un cargamento de 800.000 barriles dura ~15 días" },
      { "id": "mensual", "texto": "Necesidad mensual: 800.000 × 2 ≈ 1,6 millones de barriles" }
    ],
    "hechos": [
      "A 130.000 b/d, el consumo mensual sería 3,9 millones, no 1,6 millones.",
      "A 150.000 b/d, serían 4,5 millones mensuales.",
      "Un cargamento de 800.000 barriles dura entre 5,3 y 6,2 días, no 15.",
      "Para que 800.000 durasen 15 días, el consumo tendría que ser de solo 53.333 b/d.",
      "El cálculo mensual está errado por un factor aproximado de 2,4 a 2,8."
    ]
  },
  "termoelectricas": {
    "titulo": "El salto que faltó sumar",
    "intro": "Triana estima bien el orden de magnitud por planta, y luego olvida multiplicar. Cinco o seis bloques de 200 millones no son 200 millones.",
    "coste_mw_min_usd": 800000,
    "coste_mw_max_usd": 1000000,
    "coste_planta_usd": 200000000,
    "plantas_min": 5,
    "plantas_max": 6,
    "coste_afirmado_usd": 200000000,
    "coste_real_min_usd": 1000000000,
    "coste_real_max_usd": 1200000000,
    "costes_omitidos": [
      "Transmisión",
      "Subestaciones",
      "Control y estabilidad de red",
      "Reservas de potencia",
      "Puertos y almacenamiento",
      "Suministro de combustible",
      "Mantenimiento",
      "Capital circulante"
    ],
    "cierre": "Su cifra sirve como cálculo incompleto de generación, no como presupuesto del rescate eléctrico."
  },
  "electricidad_regional": {
    "titulo": "El coste técnico no es excepcional",
    "intro": "Triana usa la tarifa subsidiada cubana para sugerir que el consumidor paga muy poco. Es cierto nominalmente, pero no dice nada sobre el coste de producir electricidad. Otros sistemas insulares afrontan costes físicos iguales o mayores.",
    "paises": [
      { "pais": "Cuba", "tarifa_usd_kwh": null, "perdidas_pct": null, "nota": "Tarifa fuertemente subsidiada, servicio muy interrumpido: el precio no recupera costes y la escasez sustituye al precio." },
      { "pais": "Jamaica", "tarifa_usd_kwh": 0.36, "perdidas_pct": 27, "nota": "Alta dependencia importadora, pérdidas elevadas y pequeña escala." },
      { "pais": "Rep. Dominicana", "tarifa_usd_kwh": 0.24, "perdidas_pct": 30, "nota": "Tarifas históricamente altas, subsidios sustanciales y debilidad de cobro." },
      { "pais": "Puerto Rico", "tarifa_usd_kwh": 0.28, "perdidas_pct": 15, "nota": "Insularidad, combustibles importados y red vulnerable a huracanes." },
      { "pais": "Barbados", "tarifa_usd_kwh": 0.30, "perdidas_pct": 8, "nota": "Sistema pequeño e insular; transición renovable costosa pero viable, mejor entorno de inversión." }
    ],
    "diferencia": "La diferencia decisiva no es el coste físico: es que Cuba combinó alto coste técnico, tarifa artificialmente baja, baja inversión, restricción financiera y mantenimiento diferido. El resultado previsible es déficit de caja, averías, apagones, menos producción y menos recaudación."
  },
  "arroz": {
    "titulo": "La parcela que no es el país",
    "intro": "Triana cita rendimientos de 7, 8 y 9 toneladas de arroz por hectárea de productores vietnamitas. Son posibles en parcelas intensivas, variedades seleccionadas y proyectos demostrativos. Confundirlos con el rendimiento nacional es sesgo de selección.",
    "rendimientos_demostrativos": [7, 8, 9],
    "faltan": [
      "Rendimiento nacional promedio",
      "Varianza entre parcelas",
      "Coste por hectárea",
      "Agua y fertilizante por hectárea",
      "Rentabilidad real",
      "Porcentaje de superficie replicable"
    ],
    "cierre": "Sin eso, la cifra funciona como anécdota favorable, no como evidencia de política agrícola."
  },
  "aciertos": [
    { "titulo": "Exige secuencia, responsables y calendario", "texto": "El paquete contiene el «qué», pero no el «cómo, cuándo y quién». Sin eso, el gobierno puede anunciar mucho, ejecutar poco y culpar luego a la implementación. Es su crítica más importante, aunque no la lleva hasta el final." },
    { "titulo": "Sobran empresas estatales", "texto": "Cuba mantiene miles de empresas formalmente estatales, muchas insolventes y sin función estratégica clara. Reducirlas y concentrarse en lo realmente estratégico libera capital, subsidios y control administrativo." },
    { "titulo": "Los topes de precio mal diseñados destruyen oferta", "texto": "Un precio máximo por debajo del coste genera menos oferta, subdeclaración, mercado negro, corrupción y peor calidad. Su error no está en la teoría, sino en no desarrollar qué política de competencia y transferencias lo sustituiría." },
    { "titulo": "Mejor subsidiar personas que productos", "texto": "Subsidiar a todos por igual acaba beneficiando también a hogares con recursos. Las transferencias focalizadas mejoran eficiencia y progresividad, aunque su idea de «tiendas específicas» reproduciría colas, estigma y arbitraje." },
    { "titulo": "La competencia no depende de la propiedad privada", "texto": "Varias empresas públicas pueden competir. Pero solo si tienen presupuestos separados, sin rescates automáticos, con directivos no nombrados por el mismo órgano. Si no, cuatro empresas estatales son cuatro departamentos del mismo monopolio." },
    { "titulo": "El sector privado es estratégico, no un apéndice", "texto": "Con cerca del 35 % del empleo fuera del sector estatal, tratarlo como complemento tolerado es insostenible. Limitar por decreto el número de empresas de una persona no elimina la concentración: la traslada a testaferros." }
  ],
  "errores_cuantitativos": [
    { "titulo": "Aritmética petrolera incompatible", "texto": "Sus tres cifras sobre la necesidad petrolera no pueden coexistir. El cálculo mensual está errado por un factor de 2,4 a 2,8, hablando de la principal restricción energética del país." },
    { "titulo": "Confunde consumo, demanda y necesidad técnica", "texto": "«Cuba necesita 130.000–150.000 barriles diarios» mezcla consumo observado de una economía deprimida con la demanda de una economía normalizada, sin año, fuente ni composición." },
    { "titulo": "No multiplica el coste eléctrico", "texto": "Cinco o seis centrales de 200 millones no son 200 millones, sino 1.000 a 1.200. Y sustituir bloques de generación no equivale a reconstruir el sistema completo." },